{
  "schema": "https://aliakbari.dev/schemas/ops-summary-v1.json",
  "report_version": 1,
  "sli_version": 1,
  "service": "https://aliakbari.dev",
  "generator": {
    "name": "opsledger",
    "version": "ops-publish",
    "commit": "874d8ad846e79e2c07e54570151b2207b587f3f6"
  },
  "window": {
    "first_date": "2026-09-23",
    "last_date": "2026-10-20",
    "days": 28
  },
  "days": [
    {
      "date": "2026-10-12",
      "sha256": "ddc2c3ba32bf958b794c43bd5320065fda10c4ebe1673ae0bb5ee6a6cd65e5f2",
      "origin": true,
      "probe": true
    },
    {
      "date": "2026-10-13",
      "sha256": "798d699a1dd689c65293453926c1a63d5974f6b4f7364dbae016eae2cc0fcadd",
      "origin": true,
      "probe": true
    },
    {
      "date": "2026-10-14",
      "sha256": "ae3c9bfe4a57d248484de35b232e3d2df8430c80accdab0fac5283e2ee64e5e5",
      "origin": true,
      "probe": true
    },
    {
      "date": "2026-10-15",
      "sha256": "291f88ac35ac919bfa6ac0426b8c99c2ad1bd21186f482046fd7a2348953e095",
      "origin": true,
      "probe": true
    },
    {
      "date": "2026-10-16",
      "sha256": "b088fa78096a7f7b43331ec370727058d7053b96c165b8bc962a44d8601a6fbc",
      "origin": true,
      "probe": true
    },
    {
      "date": "2026-10-17",
      "sha256": "0f48d0cff616b7a12b8c0b858e7a66400fcb3cd9fffc05768d503378bd17808c",
      "origin": true,
      "probe": true
    },
    {
      "date": "2026-10-18",
      "sha256": "a2dad6752368ac6bb84d4a83e2bc1ab6c922cabed36143df26ba6ac1357123f4",
      "origin": true,
      "probe": true
    },
    {
      "date": "2026-10-19",
      "sha256": "1b0e6f7d45ccdbabfca3ba472ceca5e7c2b36509e659e2888fd2a52de06cbdaf",
      "origin": true,
      "probe": true
    },
    {
      "date": "2026-10-20",
      "sha256": "00259316031a2315aa5f1584b2e331b51bb2f67dcd4852dfc45551422fb6cddd",
      "origin": true,
      "probe": true
    }
  ],
  "missing_days": [
    "2026-09-23",
    "2026-09-24",
    "2026-09-25",
    "2026-09-26",
    "2026-09-27",
    "2026-09-28",
    "2026-09-29",
    "2026-09-30",
    "2026-10-01",
    "2026-10-02",
    "2026-10-03",
    "2026-10-04",
    "2026-10-05",
    "2026-10-06",
    "2026-10-07",
    "2026-10-08",
    "2026-10-09",
    "2026-10-10",
    "2026-10-11"
  ],
  "targets": {
    "availability": 0.995,
    "latency": 0.99,
    "probe": 0.995,
    "completeness": 0.99
  },
  "origin": {
    "days_with_data": 9,
    "availability": {
      "n": 70087,
      "good": 70087,
      "bad": 0,
      "ratio": 1,
      "wilson95_lower": 0.999945193,
      "wilson95_upper": 1,
      "defined": true
    },
    "availability_budget": {
      "target": 0.995,
      "eligible": 70087,
      "bad": 0,
      "allowed": 350.435,
      "consumed": 0,
      "remaining": 1,
      "defined": true
    },
    "latency": {
      "n": 70087,
      "good": 68983,
      "bad": 1104,
      "ratio": 0.984248149,
      "wilson95_lower": 0.983299429,
      "wilson95_upper": 0.985143788,
      "defined": true
    },
    "latency_budget": {
      "target": 0.99,
      "eligible": 70087,
      "bad": 1104,
      "allowed": 700.87,
      "consumed": 1.575185127,
      "remaining": -0.575185127,
      "defined": true
    },
    "latency_by_class": {
      "api": {
        "n": 896,
        "good": 821,
        "bad": 75,
        "ratio": 0.916294643,
        "wilson95_lower": 0.896335373,
        "wilson95_upper": 0.932699556,
        "defined": true
      },
      "page": {
        "n": 11458,
        "good": 11264,
        "bad": 194,
        "ratio": 0.983068598,
        "wilson95_lower": 0.980539267,
        "wilson95_upper": 0.985274127,
        "defined": true
      },
      "rsc": {
        "n": 57733,
        "good": 56898,
        "bad": 835,
        "ratio": 0.985536868,
        "wilson95_lower": 0.984530184,
        "wilson95_upper": 0.986478943,
        "defined": true
      }
    },
    "percentiles": {
      "api": {
        "n": 961,
        "p50": {
          "defined": true,
          "rank": 481,
          "zero": false,
          "index": 116,
          "lower_us": 23170,
          "upper_us": 25268,
          "reliable": true
        },
        "p90": {
          "defined": true,
          "rank": 865,
          "zero": false,
          "index": 130,
          "lower_us": 77935,
          "upper_us": 84990,
          "reliable": true
        },
        "p95": {
          "defined": true,
          "rank": 913,
          "zero": false,
          "index": 140,
          "lower_us": 185363,
          "upper_us": 202141,
          "reliable": true
        },
        "p99": {
          "defined": true,
          "rank": 952,
          "zero": false,
          "index": 149,
          "lower_us": 404281,
          "upper_us": 440872,
          "reliable": false
        },
        "histogram": {
          "scale": 3,
          "zero_count": 0,
          "offset": 100,
          "counts": [
            3,
            0,
            0,
            2,
            0,
            8,
            10,
            25,
            34,
            36,
            106,
            40,
            39,
            61,
            55,
            53,
            38,
            45,
            57,
            21,
            35,
            29,
            39,
            27,
            19,
            21,
            12,
            13,
            23,
            10,
            4,
            5,
            12,
            4,
            5,
            4,
            9,
            2,
            2,
            4,
            8,
            6,
            6,
            3,
            3,
            7,
            4,
            2,
            0,
            1,
            2,
            0,
            2,
            2,
            1,
            0,
            0,
            1,
            0,
            0,
            0,
            0,
            1
          ],
          "sum": 45212000,
          "min": 6000,
          "max": 1325000
        }
      },
      "page": {
        "n": 12381,
        "p50": {
          "defined": true,
          "rank": 6191,
          "zero": false,
          "index": 118,
          "lower_us": 27554,
          "upper_us": 30049,
          "reliable": true
        },
        "p90": {
          "defined": true,
          "rank": 11143,
          "zero": false,
          "index": 131,
          "lower_us": 84989,
          "upper_us": 92682,
          "reliable": true
        },
        "p95": {
          "defined": true,
          "rank": 11762,
          "zero": false,
          "index": 136,
          "lower_us": 131072,
          "upper_us": 142936,
          "reliable": true
        },
        "p99": {
          "defined": true,
          "rank": 12258,
          "zero": false,
          "index": 148,
          "lower_us": 370727,
          "upper_us": 404282,
          "reliable": true
        },
        "histogram": {
          "scale": 3,
          "zero_count": 402,
          "offset": 92,
          "counts": [
            7,
            0,
            0,
            30,
            0,
            0,
            42,
            0,
            52,
            0,
            37,
            34,
            0,
            32,
            32,
            36,
            41,
            66,
            347,
            273,
            364,
            848,
            898,
            803,
            713,
            685,
            825,
            463,
            635,
            525,
            546,
            424,
            384,
            374,
            334,
            249,
            240,
            210,
            181,
            152,
            156,
            110,
            94,
            90,
            68,
            81,
            53,
            48,
            53,
            38,
            34,
            35,
            31,
            22,
            26,
            27,
            17,
            11,
            9,
            14,
            6,
            10,
            10,
            6,
            3,
            10,
            4,
            1,
            2,
            0,
            2,
            13,
            6,
            7
          ],
          "sum": 617977000,
          "min": 0,
          "max": 1689000
        }
      },
      "rsc": {
        "n": 59312,
        "p50": {
          "defined": true,
          "rank": 29656,
          "zero": false,
          "index": 120,
          "lower_us": 32768,
          "upper_us": 35734,
          "reliable": true
        },
        "p90": {
          "defined": true,
          "rank": 53381,
          "zero": false,
          "index": 133,
          "lower_us": 101070,
          "upper_us": 110218,
          "reliable": true
        },
        "p95": {
          "defined": true,
          "rank": 56347,
          "zero": false,
          "index": 137,
          "lower_us": 142935,
          "upper_us": 155872,
          "reliable": true
        },
        "p99": {
          "defined": true,
          "rank": 58719,
          "zero": false,
          "index": 147,
          "lower_us": 339958,
          "upper_us": 370728,
          "reliable": true
        },
        "histogram": {
          "scale": 3,
          "zero_count": 330,
          "offset": 79,
          "counts": [
            16,
            0,
            0,
            0,
            0,
            0,
            0,
            0,
            21,
            0,
            0,
            0,
            0,
            20,
            0,
            0,
            18,
            0,
            0,
            31,
            0,
            28,
            0,
            23,
            20,
            0,
            33,
            22,
            37,
            71,
            98,
            610,
            692,
            1007,
            2771,
            3265,
            3496,
            3347,
            3216,
            4355,
            2687,
            3590,